[
  {
    "id": "chicken-001",
    "title": "雞胸高麗菜板豆腐昆布鍋",
    "category": "雞肉",
    "method": "水煮",
    "status": "needs_revision",
    "summary": "做過；雞肉稍柴，高麗菜葉太軟，菜梗仍不夠透。",
    "evidence": "我昨天先滾了以後，下豆腐，然後煮3分鐘，放三片雞胸肉，再放高麗菜……雞肉有熟，稍微柴一點，但可接受；高麗菜太軟，梗的部分又有點不夠透。",
    "reviewNote": "原 AI 版本要求沖洗生雞肉，並用固定悶浸時間保證熟透；這兩點不能沿用。雞肉中心溫度需達 74°C，梗葉分段時間也要重新整理。"
  },
  {
    "id": "vegetable-001",
    "title": "椒鹽杏鮑菇",
    "category": "蔬菜菇類",
    "method": "煎炒",
    "status": "needs_revision",
    "summary": "做過；口感水水黏黏，結果不理想。",
    "evidence": "昨天的杏鮑菇煎出來水水黏黏的，效果不好。",
    "reviewNote": "舊做法未確認；先查明食材狀態、出水與下油順序，再產生新版本。"
  },
  {
    "id": "pork-001",
    "title": "糖醋里肌",
    "category": "豬肉",
    "method": "待核對",
    "status": "tested",
    "summary": "使用者回報糖醋里肌很成功且小里肌嫩度滿意；完整實作配方與版本仍待核對。",
    "evidence": "像是我之前做的糖醋里肌肉。",
    "reviewNote": "成功的保嫩經驗可作為新菜的設計線索，但原食譜版本未還原，不能把這張候選卡標為 validated。"
  },
  {
    "id": "pork-002",
    "title": "剝皮辣椒松阪豬甜椒醬油蛋炒飯",
    "category": "豬肉",
    "method": "氣炸＋炒",
    "status": "needs_revision",
    "summary": "使用者回報炒飯好吃，但松阪豬韌而不脆，甜椒仍可烤久一點。",
    "evidence": "現在請你設計剝皮辣椒松阪豬加甜椒的醬油蛋炒飯的食譜。",
    "reviewNote": "下一版須把豬肉與甜椒的加熱時間分開，並核對當次實作版本。"
  },
  {
    "id": "beef-001",
    "title": "牛肋條甜咖哩飯",
    "category": "牛肉",
    "method": "燉煮",
    "status": "needs_revision",
    "summary": "使用者回報牛肋咖哩好吃，但太濃、太甜；下次須注意馬鈴薯用量。",
    "evidence": "我買完食材了，有800克牛肋條、四顆馬鈴薯、三根紅蘿蔔、蘋果、蜂蜜、一袋熟凍花椰菜。",
    "reviewNote": "需核對當次馬鈴薯與甜味來源用量，再修訂正式版本。"
  },
  {
    "id": "beef-002",
    "title": "香煎薄片和牛",
    "category": "牛肉",
    "method": "煎",
    "status": "needs_revision",
    "summary": "使用者回報熟度過高，現有火力也未煎出理想上色。",
    "evidence": "和牛排煎起來太熟 而且火力無法讓牛排表面上色的很漂亮",
    "reviewNote": "需核對肉片厚度、鍋具、實際火力和當次加熱時間；不要把延長時間當成唯一上色方式。"
  },
  {
    "id": "beef-003",
    "title": "滷牛腱",
    "category": "牛肉",
    "method": "滷",
    "status": "tested",
    "summary": "使用者回報牛腱很成功；滷汁與牛腱版本仍待核對。",
    "evidence": "滷牛腱很成功 但是白蘿蔔太苦太辣",
    "reviewNote": "牛腱的成功回饋應與白蘿蔔問題分開，不因同鍋而把牛腱標為需要修訂。"
  },
  {
    "id": "vegetable-007",
    "title": "滷白蘿蔔",
    "category": "蔬菜菇類",
    "method": "滷",
    "status": "needs_revision",
    "summary": "使用者回報白蘿蔔苦且辣；原因尚未驗證。",
    "evidence": "白蘿蔔太苦太辣 可能是中藥包煮太久 或是火太大",
    "reviewNote": "中藥包、火力和蘿蔔本身均是待驗假說；需核對當次食材、下鍋時間和滷汁味道。"
  },
  {
    "id": "pork-004",
    "title": "小里肌竹筍蛋粥",
    "category": "豬肉",
    "method": "煮粥",
    "status": "unreviewed",
    "summary": "要求從洗米開始的流程；未看到煮後回饋。",
    "evidence": "我有一盒豬小里肌，菜市場買的煮過的竹筍一根，還有5顆蛋，我想弄成粥。",
    "reviewNote": "竹筍苦味、肉的解凍狀態與鍋容量均在對話中被提出，正式做法要一併處理。"
  },
  {
    "id": "fish-001",
    "title": "香煎大比目魚",
    "category": "魚與海鮮",
    "method": "煎",
    "status": "unreviewed",
    "summary": "討論用電磁爐、米酒、白胡椒及太白粉；未看到煎後回饋。",
    "evidence": "之前都是用米酒和白胡椒粉來醃大比目魚，然後再灑上太白粉煎。",
    "reviewNote": "需確認魚片厚度與當次做法，不能只用固定時間判定熟度。"
  },
  {
    "id": "chicken-002",
    "title": "香菇冬瓜雞湯",
    "category": "雞肉",
    "method": "煮湯",
    "status": "unreviewed",
    "summary": "曾比較先煎與汆燙雞肉，後來偏好先煎；未看到煮後結果。",
    "evidence": "我想先煎。我有香菇跟薑片、米酒、清雞湯，幫我規劃食譜流程，兩人份的。",
    "reviewNote": "需確認雞肉部位與最後實際採用的湯量、煮法。"
  },
  {
    "id": "chicken-003",
    "title": "番茄雞肉炒蛋",
    "category": "雞肉",
    "method": "炒",
    "status": "unreviewed",
    "summary": "有指定雞胸、雞蛋與牛番茄的規劃需求；未看到實作回饋。",
    "evidence": "請提供我番茄雞肉炒蛋的食譜，用的是兩片雞胸肉、五顆蛋、三顆牛番茄。",
    "reviewNote": "需核對實際食材重量、雞肉處理方式與調味。"
  },
  {
    "id": "chicken-004",
    "title": "雞胸冬瓜香菇板豆腐湯",
    "category": "雞肉",
    "method": "水煮",
    "status": "unreviewed",
    "summary": "曾討論整片雞胸不切薄、不裹太白粉的版本；未看到煮後結果。",
    "evidence": "今天晚餐是全聯的鮮嫩雞胸肉、冬瓜、板豆腐，我打算加乾香菇、昆布粉，弄成水煮。",
    "reviewNote": "整片雞胸的厚度會影響熟度；需核對實物與安全判斷方式。"
  },
  {
    "id": "chicken-005",
    "title": "白蘿蔔板豆腐雞胸昆布鍋",
    "category": "雞肉",
    "method": "水煮",
    "status": "unreviewed",
    "summary": "指定白蘿蔔、板豆腐與雞胸肉的清淡水煮餐；未看到煮後結果。",
    "evidence": "今天煮半條白蘿蔔＋板豆腐＋3片雞胸肉＋昆布粉的水煮餐。",
    "reviewNote": "需核對白蘿蔔塊大小、雞胸厚度與使用者最後的熟度回饋。"
  },
  {
    "id": "vegetable-002",
    "title": "紅燒冬瓜",
    "category": "蔬菜菇類",
    "method": "紅燒",
    "status": "unreviewed",
    "summary": "曾要求食譜；未看到實作回饋。",
    "evidence": "今天我想煮紅燒冬瓜，請提供食譜。",
    "reviewNote": "需確認份量、調味與實際是否做過。"
  },
  {
    "id": "vegetable-003",
    "title": "涼拌小黃瓜",
    "category": "蔬菜菇類",
    "method": "涼拌",
    "status": "tested",
    "summary": "使用者提到以前以味醂、白醋、糖與蒜粉調味；結果未記錄。",
    "evidence": "我之前是用味霖、白醋、糖、蒜粉調味，生的蒜會不會太嗆？",
    "reviewNote": "應先確認過去使用的配比與是否滿意，才能建立正式版本。"
  },
  {
    "id": "vegetable-004",
    "title": "竹筍炒豆干",
    "category": "蔬菜菇類",
    "method": "炒",
    "status": "unreviewed",
    "summary": "曾詢問竹筍與豆干的下鍋順序；未看到實作回饋。",
    "evidence": "如果竹筍跟豆干一起炒，該先炒哪個？",
    "reviewNote": "需確認竹筍是否已煮熟，以及實際料理與調味方式。"
  },
  {
    "id": "vegetable-005",
    "title": "白蘿蔔塊炒燜",
    "category": "蔬菜菇類",
    "method": "炒燜",
    "status": "unreviewed",
    "summary": "詢問白蘿蔔如何炒，並指定切塊；未看到實作回饋。",
    "evidence": "那白蘿蔔該怎麼炒？我要切塊。",
    "reviewNote": "需確認切塊大小、鍋具與最後採用的做法。"
  },
  {
    "id": "egg-001",
    "title": "電磁爐蒸蛋",
    "category": "蛋與豆製品",
    "method": "蒸",
    "status": "unreviewed",
    "summary": "曾安排電磁爐蒸蛋晚餐；未看到蒸蛋的實作結果。",
    "evidence": "今天晚餐是煎大比目魚、椒鹽杏鮑菇、電磁爐蒸蛋五顆，請幫我規劃食譜。",
    "reviewNote": "需確認容器、用水量、蒸製方式與結果。"
  }
]
