[
  {
    "id": "dinner-001",
    "title": "和牛、氣炸漢堡排與配菜晚餐",
    "status": "needs_revision",
    "evidence": "火力不太夠，煎出來有點失敗，而且氣炸鍋沒噴油，導致沾黏，而且過熟。",
    "reviewNote": "舊組合餐條目已從食譜卡清單移出。食材與各自結果尚不能可靠對應，待確認後逐道拆分。"
  },
  {
    "id": "pork-003",
    "title": "氣炸松阪豬甜椒配雜糧饅頭",
    "status": "unreviewed",
    "evidence": "幫我設計松阪豬和甜椒的氣炸流程＋醃肉。",
    "reviewNote": "舊條目混合松阪豬、甜椒和饅頭；各道做法與實作結果待核對後拆分。"
  },
  {
    "id": "fish-002",
    "title": "馬告鯛魚排配豆包青江菜",
    "status": "unreviewed",
    "evidence": "今天晚餐的有馬告鯛魚排、生豆包、青江菜，我想用比較清淡的方式料理。",
    "reviewNote": "舊條目混合鯛魚、豆包與青江菜；烹調法與實作結果待核對後拆分。"
  }
]
